{
  "$schema": "./locale.schema.json",
  "language": "zh-CN",
  "name": "简体中文",
  "englishName": "Simplified Chinese",
  "htmlLang": "zh-CN",
  "punctuation": {
    ":": "：",
    "?": "？",
    "!": "！"
  },
  "punctuationSkipSuffixes": [
    "...",
    "…",
    "：",
    "？",
    "！"
  ],
  "patterns": [
    {
      "id": "thoughtFor",
      "pattern": "^Thought for (\\d+(?:\\.\\d+)?)(s|m|h|ms)$",
      "flags": "i",
      "template": "思考了 {1}{2}",
      "replace": {
        "2": "durationUnit"
      },
      "sample": "Thought for 5s"
    },
    {
      "id": "workedFor",
      "pattern": "^Worked for (\\d+(?:\\.\\d+)?)(s|m|h|ms)$",
      "flags": "i",
      "template": "运行了 {1}{2}",
      "replace": {
        "2": "durationUnit"
      },
      "sample": "Worked for 12.25m"
    },
    {
      "id": "selectModel",
      "pattern": "^Select model,\\s*current:\\s*(.+)$",
      "flags": "i",
      "template": "选择模型，当前：{1}",
      "sample": "Select model, current: Gemini 3.1 Pro (High)"
    },
    {
      "id": "aiCredits",
      "pattern": "^Available AI Credits:\\s*(\\d+)$",
      "flags": "i",
      "template": "可用 AI 额度：{1}",
      "sample": "Available AI Credits: 12345"
    },
    {
      "id": "customizationBudget",
      "pattern": "^(\\d+(?:\\.\\d+)?\\s*%)\\s+of\\s+the\\s+customization\\s+budget\\s+is\\s+available(\\.?)$",
      "flags": "i",
      "template": "可用自定义预算额度为 {1}{2}",
      "replace": {
        "2": "period"
      },
      "sample": "94.4 % of the customization budget is available."
    },
    {
      "id": "showBreakdowns",
      "pattern": "^Show (\\d+) breakdowns?$",
      "flags": "i",
      "template": "显示 {1} 个明细",
      "sample": "Show 12 breakdowns"
    },
    {
      "id": "toolsEnabled",
      "pattern": "^(\\d+) tools? enabled$",
      "flags": "i",
      "template": "已启用 {1} 个工具",
      "sample": "9 tools enabled"
    },
    {
      "id": "learnMoreAbout",
      "pattern": "^Learn more about (.+)$",
      "flags": "i",
      "template": "了解更多关于 {1}",
      "replace": {
        "1": "preset"
      },
      "trimGroups": [
        1
      ],
      "sample": "Learn more about Security Preset"
    },
    {
      "id": "sendFeedbackAs",
      "pattern": "^Send feedback as (.+)$",
      "flags": "i",
      "template": "以 {1} 身份发送反馈",
      "sample": "Send feedback as user@example.com"
    },
    {
      "id": "quotaRefresh",
      "pattern": "^You have used some of your (weekly limit|5-hour limit), it will fully refresh in (.+)\\.$",
      "flags": "i",
      "template": "您已使用了部分{1}，将在 {2} 后完全刷新。",
      "replace": {
        "1": "limitType",
        "2": "timeParts"
      },
      "sample": "You have used some of your weekly limit, it will fully refresh in 2 days, 3 hours."
    },
    {
      "id": "loadOlderMessages",
      "pattern": "^Load older messages, showing (\\d+) of (\\d+)$",
      "flags": "i",
      "template": "加载更早的消息，当前显示 {1} / {2} 条",
      "sample": "Load older messages, showing 20 of 100"
    },
    {
      "id": "tasksRunning",
      "pattern": "^(\\d+) tasks? running$",
      "flags": "i",
      "template": "{1} 个任务正在运行",
      "sample": "7 tasks running"
    },
    {
      "id": "tokenUsage",
      "pattern": "^(Rules|Skills):\\s*(\\d+)\\s*tokens?$",
      "flags": "i",
      "template": "{1}：{2} 个 token",
      "replace": {
        "1": "tokenSection"
      },
      "sample": "Rules: 848 tokens"
    }
  ],
  "valueMaps": {
    "durationUnit": {
      "ms": "毫秒",
      "s": "秒",
      "m": "分钟",
      "h": "小时"
    },
    "limitType": {
      "weekly limit": "每周限额",
      "5-hour limit": "五小时限额"
    },
    "preset": {
      "Default": "默认",
      "Security Preset": "安全预设",
      "Artifact Review Policy": "Artifact 审查策略"
    },
    "period": {
      ".": "。",
      "": ""
    },
    "tokenSection": {
      "Rules": "规则",
      "Skills": "技能"
    }
  },
  "valueRules": {
    "timeParts": [
      {
        "pattern": "(\\d+) days?",
        "flags": "g",
        "template": "{1} 天"
      },
      {
        "pattern": "(\\d+) hours?",
        "flags": "g",
        "template": "{1} 小时"
      },
      {
        "pattern": "(\\d+) minutes?",
        "flags": "g",
        "template": "{1} 分钟"
      },
      {
        "pattern": "(\\d+) seconds?",
        "flags": "g",
        "template": "{1} 秒"
      }
    ]
  },
  "menu": {
    "File": "文件",
    "Edit": "编辑",
    "View": "视图",
    "Window": "窗口",
    "Help": "帮助",
    "New Window": "新建窗口",
    "New Conversation": "新建对话",
    "Check for Updates": "检查更新",
    "Checking for Updates...": "正在检查更新...",
    "Downloading Update...": "正在下载更新...",
    "Restart to Update": "重启并更新",
    "Docs": "文档",
    "Toggle Developer Tools": "切换开发者工具",
    "Reload": "重新加载",
    "Force Reload": "强制重新加载",
    "Actual Size": "实际大小",
    "Zoom In": "放大",
    "Zoom Out": "缩小",
    "Toggle Full Screen": "切换全屏",
    "Minimize": "最小化",
    "Close": "关闭",
    "Quit": "退出",
    "Undo": "撤销",
    "Redo": "重做",
    "Cut": "剪切",
    "Copy": "复制",
    "Paste": "粘贴",
    "Select All": "全选"
  },
  "text": {
    "Run": "运行",
    "Agent": "代理",
    "Configure agent execution, queued message delivery, and permissions.": "配置代理执行、排队消息投递和权限。",
    "Execution": "执行",
    "Queued Messages": "排队消息",
    "Configure when follow-up messages are sent.": "配置后续消息的发送时机。",
    "Queue After Turn": "本轮结束后排队",
    "Send Immediately": "立即发送",
    "Plan": "套餐",
    "Your Plan:": "当前套餐：",
    "You can upgrade to a Google AI Ultra plan to receive higher rate limits.": "您可以升级到 Google AI Ultra 套餐以获得更高的速率限制。",
    "You can upgrade to a": "您可以升级到",
    "plan to receive higher rate limits.": "套餐以获得更高的速率限制。",
    "Configure the browser subagent. It requires Google Chrome": "配置浏览器子代理。这需要系统已安装 Google Chrome",
    "to be installed.": "已安装。",
    "The browser subagent can be invoked by typing /browser in the conversation input box.": "可以通过在对话输入框中输入 /browser 来调用浏览器子代理。",
    "Terms of Service": "服务条款",
    "By using this app, you agree to its": "使用本应用即表示您同意",
    "You currently don't have any MCP Servers installed.": "您当前尚未安装任何 MCP 服务器。",
    "Add an MCP server above or add a custom one via the MCP Config.": "请在上方添加 MCP 服务器，或通过 MCP 配置添加自定义服务器。",
    "Add MCP": "添加 MCP",
    "Open MCP Config": "打开 MCP 配置",
    "MCP Config": "MCP 配置",
    "Also includes": "此项目还会包含",
    "global settings": "全局设置",
    "when working in this project.": "。",
    "New Conversation in Project": "在项目中新建对话",
    "Loading": "加载中",
    "See less": "收起",
    "Install IDE": "安装 IDE",
    "Load older messages": "加载更早的消息",
    "Undo changes up to this point": "撤销到此处之前的更改",
    "Message input": "消息输入框",
    "Overview": "概览",
    "Auxiliary Pane": "辅助面板",
    "Select Environment": "选择环境",
    "New Conversation": "新建对话",
    "Conversation History": "对话历史",
    "Scheduled Tasks": "定时任务",
    "Projects": "项目",
    "Settings": "设置",
    "General": "常规",
    "Account": "账号",
    "Permissions": "权限",
    "Appearance": "外观",
    "Models": "模型",
    "Customizations": "自定义",
    "Browser": "浏览器",
    "Not in Project": "未归属项目",
    "Conversations": "对话",
    "Shortcuts": "快捷键",
    "Provide Feedback": "提供反馈",
    "Configure the agent's visual theme and display preferences.": "配置代理的视觉主题和显示偏好。",
    "Chat Settings": "聊天设置",
    "Verbose agent chat": "显示代理详细过程",
    "Display and preserve intermediate thinking steps": "显示并保留中间思考步骤",
    "Select light, dark, or inherit system settings.": "选择浅色、深色，或跟随系统设置。",
    "Light Theme": "浅色主题",
    "Dark Theme": "深色主题",
    "Preset": "预设",
    "Default Light": "默认浅色",
    "Default Dark": "默认深色",
    "System": "跟随系统",
    "Light": "浅色",
    "Dark": "深色",
    "Background": "背景",
    "Foreground": "前景",
    "Accent": "强调色",
    "Local": "本地",
    "Ask anything, @ to mention, / for actions": "输入任何问题，@ 提及，/ 执行动作",
    "New Window": "新建窗口",
    "No agents running": "没有正在运行的代理",
    "Open Antigravity": "打开 Antigravity",
    "Authentication Required": "需要登录",
    "To start using the agent, please sign in with your Google account.": "要开始使用代理，请先登录你的 Google 账号。",
    "Sign In": "登录",
    "Open Settings": "打开设置",
    "There was an unexpected issue setting up your account.": "设置账号时出现意外问题。",
    "Continue with different account": "使用其他账号继续",
    "Having trouble? Let us know": "遇到问题？告诉我们",
    "Previous": "上一步",
    "Next": "下一步",
    "Retry": "重试",
    "Cancel": "取消",
    "Save": "保存",
    "Close": "关闭",
    "Quit": "退出",
    "Check for Updates": "检查更新",
    "Checking for Updates...": "正在检查更新...",
    "Downloading Update...": "正在下载更新...",
    "Restart to Update": "重启并更新",
    "File": "文件",
    "Edit": "编辑",
    "View": "视图",
    "Window": "窗口",
    "Help": "帮助",
    "App": "应用",
    "Workspace": "工作区",
    "Start a new chat": "发起新聊天",
    "Search conversations": "搜索对话...",
    "Delete conversation": "删除对话",
    "Rename conversation": "重命名对话",
    "Clear all conversations": "清空所有对话",
    "Export conversation": "导出对话",
    "Export as Markdown": "导出为 Markdown",
    "Export as JSON": "导出为 JSON",
    "Share conversation": "分享对话",
    "Previous 7 days": "最近 7 天",
    "Previous 30 days": "最近 30 天",
    "No history found": "未找到历史记录",
    "Pin conversation": "固定对话",
    "Unpin conversation": "取消固定",
    "Conversation details": "对话详情",
    "View original message": "查看原始消息",
    "Copy conversation": "复制对话内容",
    "Copy block": "复制文本块",
    "Edit message": "编辑消息",
    "Regenerate response": "重新生成回答",
    "Response regenerated": "回答已重新生成",
    "Keep reading": "继续阅读",
    "Show raw markdown": "显示 Markdown 源码",
    "Rendered view": "渲染视图",
    "Collapse message": "收起消息",
    "Expand message": "展开消息",
    "Scroll to bottom": "回到最下方",
    "Type a message...": "输入消息...",
    "Send message": "发送消息",
    "Stop generating": "停止生成",
    "Stop agent": "停止代理",
    "Add attachment": "添加附件",
    "Upload file": "上传文件",
    "Upload folder": "上传文件夹",
    "Drop files here": "拖拽文件至此",
    "Attach from project": "从项目中添加",
    "Select model": "选择模型",
    "Current model": "当前模型",
    "Default model": "默认模型",
    "Advanced models": "高级模型",